Transform id,Description,Input type,Sets,Output
opencti.email-message.StixObservableToDetails,OpenCTI: EmailMessage to Details,maltego.STIX2.email-message,To Details [OpenCTI],
opencti.directory.StixObservableToDetails,OpenCTI: Directory to Details,maltego.STIX2.directory,To Details [OpenCTI],
opencti.x-opencti-hostname.StixObservableToDetails,OpenCTI: Hostname to Details,maltego.STIX2.x-opencti-hostname,To Details [OpenCTI],
opencti.x-opencti-text.StixObservableToDetails,OpenCTI: Text to Details,maltego.STIX2.x-opencti-text,To Details [OpenCTI],
opencti.x-opencti-cryptographic-key.StixObservableToDetails,OpenCTI: Cryptographic Key to Details,maltego.STIX2.x-opencti-cryptographic-key,To Details [OpenCTI],
opencti.x-opencti-cryptocurrency-wallet.StixObservableToDetails,OpenCTI: Cryptocurrency Wallet to Details,maltego.STIX2.x-opencti-cryptocurrency-wallet,To Details [OpenCTI],
opencti.x-opencti-user-agent.StixObservableToDetails,OpenCTI: User-Agent to Details,maltego.STIX2.x-opencti-user-agent,To Details [OpenCTI],
opencti.process.StixObservableToIndicators,OpenCTI: Process To Indicators,maltego.STIX2.process,To Indicators [OpenCTI],
opencti.file.StixObservableToIndicators,OpenCTI: File To Indicators,maltego.STIX2.file,To Indicators [OpenCTI],
opencti.url.StixObservableToIndicators,OpenCTI: Url To Indicators,maltego.STIX2.url,To Indicators [OpenCTI],
opencti.software.StixObservableToIndicators,OpenCTI: Software To Indicators,maltego.STIX2.software,To Indicators [OpenCTI],
opencti.mutex.StixObservableToIndicators,OpenCTI: Mutex To Indicators,maltego.STIX2.mutex,To Indicators [OpenCTI],
opencti.x509-certificate.StixObservableToIndicators,OpenCTI: X509Certificate To Indicators,maltego.STIX2.x509-certificate,To Indicators [OpenCTI],
opencti.artifact.StixObservableToIndicators,OpenCTI: Artifact To Indicators,maltego.STIX2.artifact,To Indicators [OpenCTI],
opencti.network-traffic.StixObservableToIndicators,OpenCTI: NetworkTraffic To Indicators,maltego.STIX2.network-traffic,To Indicators [OpenCTI],
opencti.user-account.StixObservableToIndicators,OpenCTI: UserAccount To Indicators,maltego.STIX2.user-account,To Indicators [OpenCTI],
opencti.windows-registry-key.StixObservableToIndicators,OpenCTI: WindowsRegistryKey To Indicators,maltego.STIX2.windows-registry-key,To Indicators [OpenCTI],
opencti.ipv6-addr.StixObservableToIndicators,OpenCTI: Ipv6Addr To Indicators,maltego.STIX2.ipv6-addr,To Indicators [OpenCTI],
opencti.ipv4-addr.StixObservableToIndicators,OpenCTI: Ipv4Addr To Indicators,maltego.STIX2.ipv4-addr,To Indicators [OpenCTI],
opencti.mac-addr.StixObservableToIndicators,OpenCTI: MacAddr To Indicators,maltego.STIX2.mac-addr,To Indicators [OpenCTI],
opencti.domain-name.StixObservableToIndicators,OpenCTI: DomainName To Indicators,maltego.STIX2.domain-name,To Indicators [OpenCTI],
opencti.autonomous-system.StixObservableToIndicators,OpenCTI: AutonomousSystem To Indicators,maltego.STIX2.autonomous-system,To Indicators [OpenCTI],
opencti.email-addr.StixObservableToIndicators,OpenCTI: EmailAddr To Indicators,maltego.STIX2.email-addr,To Indicators [OpenCTI],
opencti.email-message.StixObservableToIndicators,OpenCTI: EmailMessage To Indicators,maltego.STIX2.email-message,To Indicators [OpenCTI],
opencti.directory.StixObservableToIndicators,OpenCTI: Directory To Indicators,maltego.STIX2.directory,To Indicators [OpenCTI],
opencti.x-opencti-hostname.StixObservableToIndicators,OpenCTI: Hostname to Indicators,maltego.STIX2.x-opencti-hostname,To Indicators [OpenCTI],
opencti.x-opencti-text.StixObservableToIndicators,OpenCTI: Text to Indicators,maltego.STIX2.x-opencti-text,To Indicators [OpenCTI],
opencti.x-opencti-cryptographic-key.StixObservableToIndicators,OpenCTI: Cryptographic Key to Indicators,maltego.STIX2.x-opencti-cryptographic-key,To Indicators [OpenCTI],
opencti.x-opencti-cryptocurrency-wallet.StixObservableToIndicators,OpenCTI: Cryptocurrency Wallet to Indicators,maltego.STIX2.x-opencti-cryptocurrency-wallet,To Indicators [OpenCTI],
opencti.x-opencti-user-agent.StixObservableToIndicators,OpenCTI: User-Agent to Indicators,maltego.STIX2.x-opencti-user-agent,To Indicators [OpenCTI],
opencti.process.StixObservableToRelations,OpenCTI: Process to all Relations,maltego.STIX2.process,To all Relationships (explicit) [OpenCTI],
opencti.file.StixObservableToRelations,OpenCTI: File to all Relations,maltego.STIX2.file,To all Relationships (explicit) [OpenCTI],
opencti.url.StixObservableToRelations,OpenCTI: Url to all Relations,maltego.STIX2.url,To all Relationships (explicit) [OpenCTI],
opencti.software.StixObservableToRelations,OpenCTI: Software to all Relations,maltego.STIX2.software,To all Relationships (explicit) [OpenCTI],
opencti.mutex.StixObservableToRelations,OpenCTI: Mutex to all Relations,maltego.STIX2.mutex,To all Relationships (explicit) [OpenCTI],
opencti.x509-certificate.StixObservableToRelations,OpenCTI: X509Certificate to all Relations,maltego.STIX2.x509-certificate,To all Relationships (explicit) [OpenCTI],
opencti.artifact.StixObservableToRelations,OpenCTI: Artifact to all Relations,maltego.STIX2.artifact,To all Relationships (explicit) [OpenCTI],
opencti.network-traffic.StixObservableToRelations,OpenCTI: NetworkTraffic to all Relations,maltego.STIX2.network-traffic,To all Relationships (explicit) [OpenCTI],
opencti.user-account.StixObservableToRelations,OpenCTI: UserAccount to all Relations,maltego.STIX2.user-account,To all Relationships (explicit) [OpenCTI],
opencti.windows-registry-key.StixObservableToRelations,OpenCTI: WindowsRegistryKey to all Relations,maltego.STIX2.windows-registry-key,To Relationships (explicit) [OpenCTI],
opencti.ipv6-addr.StixObservableToRelations,OpenCTI: Ipv6Addr to all Relations,maltego.STIX2.ipv6-addr,To all Relationships (explicit) [OpenCTI],
opencti.ipv4-addr.StixObservableToRelations,OpenCTI: Ipv4Addr to all Relations,maltego.STIX2.ipv4-addr,To all Relationships (explicit) [OpenCTI],
opencti.mac-addr.StixObservableToRelations,OpenCTI: MacAddr to all Relations,maltego.STIX2.mac-addr,To all Relationships (explicit) [OpenCTI],
opencti.domain-name.StixObservableToRelations,OpenCTI: DomainName to all Relations,maltego.STIX2.domain-name,To all Relationships (explicit) [OpenCTI],
opencti.autonomous-system.StixObservableToRelations,OpenCTI: AutonomousSystem to all Relations,maltego.STIX2.autonomous-system,To all Relationships (explicit) [OpenCTI],
opencti.email-addr.StixObservableToRelations,OpenCTI: EmailAddr to all Relations,maltego.STIX2.email-addr,To all Relationships (explicit) [OpenCTI],
opencti.email-message.StixObservableToRelations,OpenCTI: EmailMessage to all Relations,maltego.STIX2.email-message,To all Relationships (explicit) [OpenCTI],
opencti.directory.StixObservableToRelations,OpenCTI: Directory to all Relations,maltego.STIX2.directory,To all Relationships (explicit) [OpenCTI],
opencti.x-opencti-hostname.StixObservableToRelations,OpenCTI: Hostname to all Relations,maltego.STIX2.x-opencti-hostname,To all Relationships (explicit) [OpenCTI],
opencti.x-opencti-text.StixObservableToRelations,OpenCTI: Text to all Relations,maltego.STIX2.x-opencti-text,To all Relationships (explicit) [OpenCTI],
opencti.x-opencti-cryptographic-key.StixObservableToRelations,OpenCTI: Cryptographic Key to all Relations,maltego.STIX2.x-opencti-cryptographic-key,To all Relationships (explicit) [OpenCTI],
opencti.x-opencti-cryptocurrency-wallet.StixObservableToRelations,OpenCTI: Cryptocurrency Wallet to all Relations,maltego.STIX2.x-opencti-cryptocurrency-wallet,To all Relationships (explicit) [OpenCTI],
opencti.x-opencti-user-agent.StixObservableToRelations,OpenCTI: User-Agent to all Relations,maltego.STIX2.x-opencti-user-agent,To all Relationships (explicit) [OpenCTI],
opencti.process.StixObservableToReports,OpenCTI: Process to Reports,maltego.STIX2.process,To Reports [OpenCTI],
opencti.file.StixObservableToReports,OpenCTI: File to Reports,maltego.STIX2.file,To Reports [OpenCTI],
opencti.url.StixObservableToReports,OpenCTI: Url to Reports,maltego.STIX2.url,To Reports [OpenCTI],
opencti.software.StixObservableToReports,OpenCTI: Software to Reports,maltego.STIX2.software,To Reports [OpenCTI],
opencti.mutex.StixObservableToReports,OpenCTI: Mutex to Reports,maltego.STIX2.mutex,To Reports [OpenCTI],
opencti.x509-certificate.StixObservableToReports,OpenCTI: X509Certificate to Reports,maltego.STIX2.x509-certificate,To Reports [OpenCTI],
opencti.artifact.StixObservableToReports,OpenCTI: Artifact to Reports,maltego.STIX2.artifact,To Reports [OpenCTI],
opencti.network-traffic.StixObservableToReports,OpenCTI: NetworkTraffic to Reports,maltego.STIX2.network-traffic,To Reports [OpenCTI],
opencti.user-account.StixObservableToReports,OpenCTI: UserAccount to Reports,maltego.STIX2.user-account,To Reports [OpenCTI],
opencti.windows-registry-key.StixObservableToReports,OpenCTI: WindowsRegistryKey to Reports,maltego.STIX2.windows-registry-key,To Reports [OpenCTI],
opencti.ipv6-addr.StixObservableToReports,OpenCTI: Ipv6Addr to Reports,maltego.STIX2.ipv6-addr,To Reports [OpenCTI],
opencti.ipv4-addr.StixObservableToReports,OpenCTI: Ipv4Addr to Reports,maltego.STIX2.ipv4-addr,To Reports [OpenCTI],
opencti.mac-addr.StixObservableToReports,OpenCTI: MacAddr to Reports,maltego.STIX2.mac-addr,To Reports [OpenCTI],
opencti.domain-name.StixObservableToReports,OpenCTI: DomainName to Reports,maltego.STIX2.domain-name,To Reports [OpenCTI],
opencti.autonomous-system.StixObservableToReports,OpenCTI: AutonomousSystem to Reports,maltego.STIX2.autonomous-system,To Reports [OpenCTI],
opencti.email-addr.StixObservableToReports,OpenCTI: EmailAddr to Reports,maltego.STIX2.email-addr,To Reports [OpenCTI],
opencti.email-message.StixObservableToReports,OpenCTI: EmailMessage to Reports,maltego.STIX2.email-message,To Reports [OpenCTI],
opencti.directory.StixObservableToReports,OpenCTI: Directory to Reports,maltego.STIX2.directory,To Reports [OpenCTI],
opencti.x-opencti-hostname.StixObservableToReports,OpenCTI: Hostname to Reports,maltego.STIX2.x-opencti-hostname,To Reports [OpenCTI],
opencti.x-opencti-text.StixObservableToReports,OpenCTI: Text to Reports,maltego.STIX2.x-opencti-text,To Reports [OpenCTI],
opencti.x-opencti-cryptographic-key.StixObservableToReports,OpenCTI: Cryptographic Key to Reports,maltego.STIX2.x-opencti-cryptographic-key,To Reports [OpenCTI],
opencti.x-opencti-cryptocurrency-wallet.StixObservableToReports,OpenCTI: Cryptocurrency Wallet to Reports,maltego.STIX2.x-opencti-cryptocurrency-wallet,To Reports [OpenCTI],
opencti.x-opencti-user-agent.StixObservableToReports,OpenCTI: User-Agent to Reports,maltego.STIX2.x-opencti-user-agent,To Reports [OpenCTI],
opencti.maltego-ipv4address.PlainSearch,OpenCTI: Search for IPv4 Address,maltego.IPv4Address,Search for Entities [OpenCTI],
opencti.maltego-ipv6address.PlainSearch,OpenCTI: Search for IPv6 Address,maltego.IPv6Address,Search for Entities [OpenCTI],
opencti.maltego-domain.PlainSearch,OpenCTI: Search for Domain,maltego.Domain,Search for Entities [OpenCTI],
opencti.maltego-hash.PlainSearch,OpenCTI: Search for Hash,maltego.Hash,Search for Entities [OpenCTI],
opencti.maltego-url.PlainSearch,OpenCTI: Search for URL,maltego.URL,Search for Entities [OpenCTI],
opencti.maltego-cve.PlainSearch,OpenCTI: Search for CVE,maltego.CVE,Search for Entities [OpenCTI],
opencti.maltego-dnsname.PlainSearch,OpenCTI: Search for DNS Name,maltego.DNSName,Search for Entities [OpenCTI],
opencti.maltego-emailaddress.PlainSearch,OpenCTI: Search for Email Address,maltego.EmailAddress,Search for Entities [OpenCTI],
opencti.maltego-phrase.PlainSearch,OpenCTI: Search by Phrase,maltego.Phrase,Search for Entities [OpenCTI],
